MCQ,Choices,Correct
What is biology?,a: The study of life | b: The study of rocks | c: The study of weather | d: The study of history,a
What is the main theme of biology that explains the unity and diversity of life?,a: Energy processing | b: Evolution | c: Regulation of internal environments | d: Cellular organization,b
"What is the process that allows organisms to move, grow, and reproduce?",a: Energy processing | b: Evolution | c: Regulation of internal environments | d: Cellular organization,a
What is the study of life at the molecular biology of a cell called?,a: Anatomy | b: Physiology | c: Ecology | d: Biochemistry,d
What is the term for the immense diversity of life on Earth?,a: Biodiversity | b: Unity | c: Evolution | d: Ecosystem,a
