MCQ,Choices,Correct
Which of the following is a unifying theme in biology?,a: Energy processing | b: Evolution | c: Regulation of internal environments | d: All of the above,d
What is the study of life called?,a: Chemistry | b: Physics | c: Biology | d: Geology,c
What is the primary unit of life?,a: Atoms | b: Molecules | c: Cells | d: Tissues,c
Which of the following is NOT a subdiscipline within biology?,a: Molecular biology | b: Chemistry | c: Anatomy and physiology | d: Evolutionary biology,b
When did life on Earth emerge?,a: 1 billion years ago | b: 2.5 billion years ago | c: 3.7 billion years ago | d: 5 billion years ago,c
